{
  "indexId": "xprimeray.glowing_heart.difference_packet_index.v0.preview",
  "title": "Project Glowing Heart Difference Packet Exhibit Index",
  "version": "v0.preview",
  "generatedUtc": "2026-07-01T03:39:51Z",
  "entries": [
    {
      "id": "comparable_zero",
      "title": "Comparable Zero",
      "sourceCase": "Case A",
      "status": "Comparable",
      "rule": "bend_magnitude_same_observer",
      "reason": "Matching retained Core fixture comparison identity, observer basis, channel, and coordinate grid produced zero numeric difference.",
      "leftFixture": "Fixtures/grin_radial_smoke.json",
      "rightFixture": "Fixtures/grin_radial_smoke.json",
      "leftChannel": "bend_magnitude_metric",
      "rightChannel": "bend_magnitude_metric",
      "comparisonMode": "core_vs_core",
      "parityClaim": "NONE",
      "runtimeExecuted": false,
      "packetSchema": "xprimeray.glowing_heart.difference_packet.v2.0",
      "metrics": { "countCompared": 880, "maxAbsDifference": 0, "meanAbsDifference": 0, "nonZeroCount": 0 },
      "claimBoundary": ["Core-vs-Core only.", "Not a Godot comparison.", "Not image or pixel comparison.", "Not parity.", "Zero difference does not establish equivalence with another runtime or measurement system."],
      "galleryDocPath": "Docs/xPRIMEray/project_glowing_heart_v2_4_difference_packet_gallery.md",
      "sourceReportPath": "reports/glowing_heart_v2_3_difference_fixture_cases.preview.md",
      "lastVerifiedOutputPath": "/tmp/glowing_heart_v2_3_1/case_a_zero/difference_packet.json",
      "recommendedRenderer": ["table", "card", "matrix", "atlas_graph_node"]
    },
    {
      "id": "comparable_nonzero",
      "title": "Comparable Non-Zero",
      "sourceCase": "Case B",
      "status": "Comparable",
      "rule": "bend_magnitude_same_observer",
      "reason": "The declared-compatible amplitude variant produced non-zero numeric differences in retained Core bend values.",
      "leftFixture": "Fixtures/grin_radial_smoke.json",
      "rightFixture": "Fixtures/grin_radial_smoke_variant.json",
      "leftChannel": "bend_magnitude_metric",
      "rightChannel": "bend_magnitude_metric",
      "comparisonMode": "core_vs_core",
      "parityClaim": "NONE",
      "runtimeExecuted": false,
      "packetSchema": "xprimeray.glowing_heart.difference_packet.v2.0",
      "metrics": { "countCompared": 880, "maxAbsDifference": 0.00031490779, "meanAbsDifference": 0.00019547191841352225, "nonZeroCount": 872 },
      "claimBoundary": ["Core-vs-Core only.", "Not a Godot comparison.", "Not image or pixel comparison.", "Not parity.", "Non-zero difference demonstrates numeric distinction between retained Core artifacts only."],
      "galleryDocPath": "Docs/xPRIMEray/project_glowing_heart_v2_4_difference_packet_gallery.md",
      "sourceReportPath": "reports/glowing_heart_v2_3_difference_fixture_cases.preview.md",
      "lastVerifiedOutputPath": "/tmp/glowing_heart_v2_3_1/case_b_nonzero/difference_packet.json",
      "recommendedRenderer": ["table", "card", "matrix", "atlas_graph_node"]
    },
    {
      "id": "unknown_observer_mismatch",
      "title": "Unknown Observer Mismatch",
      "sourceCase": "Case C",
      "status": "Unknown",
      "rule": "bend_magnitude_context_mismatch",
      "reason": "The retained observer basis mismatch made comparison eligibility unknown, so values were not compared.",
      "leftFixture": "Fixtures/grin_radial_smoke.json",
      "rightFixture": "Fixtures/grin_radial_smoke_observer_variant.json",
      "leftChannel": "bend_magnitude_metric",
      "rightChannel": "bend_magnitude_metric",
      "comparisonMode": "core_vs_core",
      "parityClaim": "NONE",
      "runtimeExecuted": false,
      "packetSchema": "xprimeray.glowing_heart.difference_packet.v2.0",
      "metrics": { "countCompared": 0, "maxAbsDifference": 0, "meanAbsDifference": 0, "nonZeroCount": 0 },
      "claimBoundary": ["Core-vs-Core only.", "Not a Godot comparison.", "Not image or pixel comparison.", "Not parity.", "Unknown means eligibility was not established."],
      "galleryDocPath": "Docs/xPRIMEray/project_glowing_heart_v2_4_difference_packet_gallery.md",
      "sourceReportPath": "reports/glowing_heart_v2_3_difference_fixture_cases.preview.md",
      "lastVerifiedOutputPath": "/tmp/glowing_heart_v2_3_1/case_c_observer/difference_packet.json",
      "recommendedRenderer": ["table", "card", "matrix", "atlas_graph_node"]
    },
    {
      "id": "unknown_coordinate_grid_mismatch",
      "title": "Unknown Coordinate-Grid Mismatch",
      "sourceCase": "Case D",
      "status": "Unknown",
      "rule": "bend_magnitude_context_mismatch",
      "reason": "The retained coordinate-grid mismatch made comparison eligibility unknown, so values were not compared.",
      "leftFixture": "Fixtures/grin_radial_smoke.json",
      "rightFixture": "Fixtures/grin_radial_smoke_resolution_variant.json",
      "leftChannel": "bend_magnitude_metric",
      "rightChannel": "bend_magnitude_metric",
      "comparisonMode": "core_vs_core",
      "parityClaim": "NONE",
      "runtimeExecuted": false,
      "packetSchema": "xprimeray.glowing_heart.difference_packet.v2.0",
      "metrics": { "countCompared": 0, "maxAbsDifference": 0, "meanAbsDifference": 0, "nonZeroCount": 0 },
      "claimBoundary": ["Core-vs-Core only.", "Not a Godot comparison.", "Not image or pixel comparison.", "Not parity.", "Unknown means eligibility was not established."],
      "galleryDocPath": "Docs/xPRIMEray/project_glowing_heart_v2_4_difference_packet_gallery.md",
      "sourceReportPath": "reports/glowing_heart_v2_3_difference_fixture_cases.preview.md",
      "lastVerifiedOutputPath": "/tmp/glowing_heart_v2_3_1/case_d_grid/difference_packet.json",
      "recommendedRenderer": ["table", "card", "matrix", "atlas_graph_node"]
    },
    {
      "id": "not_comparable_channel",
      "title": "NotComparable Channel",
      "sourceCase": "Case E",
      "status": "NotComparable",
      "rule": "traversal_steps_vs_bend_not_comparable",
      "reason": "Bend magnitude and traversal step count are incompatible retained Core channels without a declared transform, so values were not compared.",
      "leftFixture": "Fixtures/grin_radial_smoke.json",
      "rightFixture": "Fixtures/grin_radial_smoke.json",
      "leftChannel": "bend_magnitude_metric",
      "rightChannel": "traversal_step_count",
      "comparisonMode": "core_vs_core",
      "parityClaim": "NONE",
      "runtimeExecuted": false,
      "packetSchema": "xprimeray.glowing_heart.difference_packet.v2.0",
      "metrics": { "countCompared": 0, "maxAbsDifference": 0, "meanAbsDifference": 0, "nonZeroCount": 0 },
      "claimBoundary": ["Core-vs-Core only.", "Not a Godot comparison.", "Not image or pixel comparison.", "Not parity.", "No bend data was relabeled as traversal steps."],
      "galleryDocPath": "Docs/xPRIMEray/project_glowing_heart_v2_4_difference_packet_gallery.md",
      "sourceReportPath": "reports/glowing_heart_v2_5_not_comparable_channel_artifact.preview.md",
      "lastVerifiedOutputPath": "/tmp/glowing_heart_v2_5_compare/difference_packet.json",
      "recommendedRenderer": ["table", "card", "matrix", "atlas_graph_node"]
    }
  ],
  "claimBoundary": [
    "Core-vs-Core only.",
    "Not a Godot comparison.",
    "Not image or pixel comparison.",
    "Not parity.",
    "Not physical validation.",
    "Not renderer equivalence.",
    "Index validity describes exhibit structure, not scientific correctness."
  ]
}
